{
  "schema_version": "1.0",
  "session": {
    "session_id": "vpn_6555f95dd8e7ea73"
  },
  "protocol": {
    "ike_version": "IKEv2"
  },
  "negotiation": {
    "status": "successful",
    "offered_proposals": [
      {
        "encryption": "AES-256-CBC",
        "integrity": "HMAC-SHA2-256",
        "dh_group": "MODP-2048"
      }
    ],
    "negotiated_proposal": {
      "encryption": "AES-256-CBC",
      "integrity": "HMAC-SHA2-256",
      "dh_group": "MODP-2048"
    }
  },
  "security_parameters": {
    "encryption": "AES-256-CBC",
    "integrity": "HMAC-SHA2-256",
    "dh_group": "MODP-2048"
  },
  "security_associations": [
    {
      "initiator_spi": "65:55:f9:5d:d8:e7:ea:73",
      "responder_spi": null,
      "packet": 1
    },
    {
      "initiator_spi": "65:55:f9:5d:d8:e7:ea:73",
      "responder_spi": "86:2e:0e:28:f1:cb:49:08",
      "packet": 2
    },
    {
      "initiator_spi": "65:55:f9:5d:d8:e7:ea:73",
      "responder_spi": "86:2e:0e:28:f1:cb:49:08",
      "packet": 3
    },
    {
      "initiator_spi": "65:55:f9:5d:d8:e7:ea:73",
      "responder_spi": "86:2e:0e:28:f1:cb:49:08",
      "packet": 4
    }
  ],
  "evidence": [
    {
      "packet": 1,
      "field": "isakmp.version",
      "value": "IKEv2",
      "session_id": "vpn_6555f95dd8e7ea73"
    },
    {
      "packet": 1,
      "field": "isakmp.ispi",
      "value": "65:55:f9:5d:d8:e7:ea:73",
      "session_id": "vpn_6555f95dd8e7ea73"
    },
    {
      "packet": 1,
      "field": "isakmp.tf.id.encr",
      "value": "AES-256-CBC",
      "session_id": "vpn_6555f95dd8e7ea73"
    },
    {
      "packet": 1,
      "field": "isakmp.tf.id.integ",
      "value": "HMAC-SHA2-256",
      "session_id": "vpn_6555f95dd8e7ea73"
    },
    {
      "packet": 1,
      "field": "isakmp.tf.id.dh",
      "value": "MODP-2048",
      "session_id": "vpn_6555f95dd8e7ea73"
    },
    {
      "packet": 2,
      "field": "isakmp.ispi",
      "value": "65:55:f9:5d:d8:e7:ea:73",
      "session_id": "vpn_6555f95dd8e7ea73"
    },
    {
      "packet": 2,
      "field": "isakmp.rspi",
      "value": "86:2e:0e:28:f1:cb:49:08",
      "session_id": "vpn_6555f95dd8e7ea73"
    },
    {
      "packet": 2,
      "field": "isakmp.tf.id.encr",
      "value": "AES-256-CBC",
      "session_id": "vpn_6555f95dd8e7ea73"
    },
    {
      "packet": 2,
      "field": "isakmp.tf.id.integ",
      "value": "HMAC-SHA2-256",
      "session_id": "vpn_6555f95dd8e7ea73"
    },
    {
      "packet": 2,
      "field": "isakmp.tf.id.dh",
      "value": "MODP-2048",
      "session_id": "vpn_6555f95dd8e7ea73"
    },
    {
      "packet": 2,
      "field": "isakmp.negotiation.status",
      "value": "successful",
      "session_id": "vpn_6555f95dd8e7ea73"
    },
    {
      "packet": 3,
      "field": "isakmp.ispi",
      "value": "65:55:f9:5d:d8:e7:ea:73",
      "session_id": "vpn_6555f95dd8e7ea73"
    },
    {
      "packet": 3,
      "field": "isakmp.rspi",
      "value": "86:2e:0e:28:f1:cb:49:08",
      "session_id": "vpn_6555f95dd8e7ea73"
    },
    {
      "packet": 4,
      "field": "isakmp.ispi",
      "value": "65:55:f9:5d:d8:e7:ea:73",
      "session_id": "vpn_6555f95dd8e7ea73"
    },
    {
      "packet": 4,
      "field": "isakmp.rspi",
      "value": "86:2e:0e:28:f1:cb:49:08",
      "session_id": "vpn_6555f95dd8e7ea73"
    }
  ],
  "metadata": {
    "source": "tshark",
    "capture_file": "secure_01.pcap"
  },
  "findings": [],
  "posture": {
    "score": 100,
    "rating": "Compliant",
    "highest_severity": null,
    "counts": {
      "Critical": 0,
      "High": 0,
      "Medium": 0,
      "Low": 0,
      "Informational": 0
    },
    "basis": "negotiated",
    "basis_note": "Judged on the parameters the peers actually negotiated."
  },
  "assessment": {
    "assessment_schema": "assessment-1.0",
    "ruleset_version": "1.0.0",
    "policy": {
      "id": "nist-baseline",
      "name": "NIST-aligned enterprise baseline",
      "version": "1.0"
    },
    "rules_evaluated": [
      "IPSEC-PROTO-001",
      "IPSEC-NEG-001",
      "IPSEC-NEG-002",
      "IPSEC-NEG-003",
      "IPSEC-NEG-004",
      "IPSEC-OBS-001",
      "IPSEC-OBS-002",
      "IPSEC-ALG-001",
      "IPSEC-ALG-002",
      "IPSEC-ALG-003",
      "IPSEC-ALG-004",
      "IPSEC-ALG-005",
      "IPSEC-INT-001",
      "IPSEC-INT-002",
      "IPSEC-INT-003",
      "IPSEC-INT-004",
      "IPSEC-DH-001",
      "IPSEC-DH-002",
      "IPSEC-DH-003"
    ]
  }
}
